,product_name,product_review,user_rating,similarity_score
1,Breakfast Stout,good color no head clean and balanced with an extremely creamy texture and a strong coffee flavor overall a great rich breakfast stout with wonderful hop balance,4.07,0.765660116
2,Flora Plum,2018 releasea pours a very light pale hazy kind of berlinerlike with a cap of bright white head which quickly fizzles out to a sharp ring nicely effervescent minimal retention and no lacings moderate sour plum and grainy wheat hefty amount of barnyard funk and a hint of spicet rich juicy plum and wheat light earthy funk finishing with a crisp mediumlight tartness on a fairly lengthy finishm mediumhigh somewhat sharp carbonation light bodiedo tasty refreshing drinkable and exceptionally well balanced the sourness is restrained and the fruit is delicious,4.44,0.765198465
3,Abricot Du Fermier,this is the best sour saison i have ever had not even up for debate the apricot is the perfect star for all of the delicately balanced flavors in the original has a bit of wine dryness to go with the sour and smooth tartness that really made the mouthfeel just mindbendingly good rich complex smooth and acidic,4.75,0.758597777
4,Flora,flora is clean crisp light and tart with smooth background tones of wine and oak its simple and in its simplicity adds meaning to all of its variants,4.75,0.748413555
5,Melcher Street (Double Dry-Hopped),canned on 10918pours a bright deeply hazy orange with over a finger of semithick pillowy white head decent retention with fair bits of lacing trickling around the glassaromas of creamy orange candied pineapple melon bits of fresh grass and light plush herbal tones the citrus punch to this bouquet is level pointedly hoppy and incredibly enjoyable and easy to nosetaste is juicy orange apricot peach guava faint grass light hops and a delicate malty sweetness consistent profile packed with citrus tropical hoppy and slightly creamy notes all in the right placesmouthfeel brings slight creaminess a balanced carbonation and an excellent bigger body that betrays itself coolly with a consistent softness on the palate throughout light bitterness from the midpalate to the finish adds a refreshing hop prickleexcellent example of balance in a neipa everything is on point with a consistency never neglecting flavor while still maintaining a calm synchronicity with a varied mouthfeel never overwhelming and the type of neipa i could drink repeatedly very welldone,4.3,0.745546123
6,King Sue,the emphasis in the beer is a strong sharp hoppy finish with citrus highlights it’s a throwback to the brewing style emphasizing a hoppy edge overshadowing a citrus profile newer approaches to a dipa have more balanced citrus flavors with a more subdued hoppy finish excellent beer,4.04,0.74548771
7,Abner,abner is perfectly balanced and not a pure juice bomb the nose is pineapple and pine the taste is less citrus and maybe more pine the finish is clean but not crisp a bit of a sweetness overall an exceptional neipa,5,0.744222943
8,Saison Bernice,a moderate fruitiness with a smooth citrus lemony aroma slight spice and light tartnessa golden color slightly hazy with a thinnish white head that quickly recreates a thin film across the glasst lemony fruitiness very clean with a light spice note and moderately low tartnessm medium bodied with moderate carbonationo near perfect this beer is an amazing example of a belgian saison absolutely delicious refreshing and nearly flawless,4.59,0.742595034
9,Double Dry Hopped Fort Point Pale Ale,truly excellent well balanced and smooth double dry hopped pale ale salad hands of citra with fruit flavors as well great aroma extremely well balanced beer and drink at 66,4.73,0.741730207
10,Fuzzy,very similar to smoothdifferenceslight color from the white peachesnose is more delicate definite peach aromataste follows the bose more delicate flavor that allows the base beer to be more cohesive with the peaches instead of a punch of nectarines also slightly more acidicfeel is also more delicateoverall this is a more delicate better balanced beer than smooth if you like a more fruit forward beer smooth is where it is at however the nuance of fuzzy is fantastic you get more of the base beer and more of that great missouri micro flora,4.67,0.741250194
11,Crusher,a bit less balanced than its alchemist counterparts crusher remains a strong and bold brew packed with hops it delivers a big green bitterness youve got also some tropical fruits and citrus notes the mouthfeel is incredibly smooth nice nice nice,4.51,0.740122946
12,Upper Case,turbid apricot hues finger tall head that recedes onto an ever present ringhuge sweet trioical fruits subtle undertones of grass pine resins and bread the balance between the hops is amazingmy my mango and sharp bittering pine the bittering just cascades away the flavors are even more balanced than they were on the noseno evidence of the abv smooth and full with a juicy start and a crisp finish low carbonationsignature trillium nuanced and bold a contradiction a new favorite,4.87,0.739370557
13,Second Fiddle,canned on 3619pours a clear faintly copperish kind of gold with an ample slightly rocky white head very nice retention that results in plenty of persistent lacing and a frothy albeit bubbly collararomas of dank peach grapefruit and tropical pith comes through strongly with lighter notes of orange zest pine and bits of hoppy spice following a restrained dankness comes through in spots while a clear crisp malt backbone that dives into deeper notes of fresh rising dough and black bread crusts starts to shine on the finishtaste profile is predominantly dank herbs and fruity rind along with subtle hints of white grape must in the background great bit of restrained hoppy pithy bitterness along with some crackery malt on the finish bitter juicy and hints of sweetness this is a soft but incredibly varied ipa profilemouthfeel brings a mediumlight body with perfectly balanced carbonation crisp throughout with an underlying fluff to give it the most easygoing kind of weight across the palate this just pops on the tongue and peaks across the palate almost perfectlya true hybrid of west coast and new england style ipas with so many ipas out there now this one may have lost some of its previous luster but damnit if it isnt still one of the more universally palatepleasing examples of an ipa out there soft but balanced and showing great variety in its profile and consistency throughout this is still quietly a great ipa that shouldnt be overlooked,4.07,0.738995781
14,Fuzzy,bottle poured into fluted sniftergolden straw clear with careful pour large bubbled foamy head pops out into bubbly collar and floating islandsaroma is tart peaches mixed with ripe and sweet peaches mingling with yeasty funkfresh real peach flavor is light but not mistakable it blends perfectly with the barrel which adds a robust earthiness tart but not puckeringeffervescent moderate carbonation and drycrisp bodyoverall a well made and excellent brew light touch in every aspect combines into an incredibly balanced final product,4.6,0.737592349
15,Weihenstephaner Hefeweissbier,absolutely shocked that i had never reviewed this one before as i consider it a the defining example of the stylegolden color somewhat cloudy pours a monster head creamy and lingeringalmost a pilsner like spicy note on the nose initially a soft slightly sweet and clove nose as it warms a bit slight hint of a sweeter fruity banana kind of aromaa slightly sweet and clove flavor up front fairly balanced despite no apparent hop flavors a very rounded flavor incredibly smooth with no rough edges not overpowering with bananaclove types of flavors  fairly clean palate for a hefemf  medium body and medium to high carbonation surprisingly creamy despite the carbonationan incredibly easy drinking beer that has the hefeweizen flavor notes without being overpowering,4.46,0.73597773
16,Barrel-Aged Abraxas,it just doesnt get much better than this all the robust flavors of the base abraxas plus the additional barrel vanilla and wood notes exceptionally well balanced simply amazing,5,0.735963307
17,Heady Topper,no canning date bought at brewery on 3819 presumably canned within a week or two priorpours a cloudy golden orange topped with a massive head of white fluff spectacular head retention leaves a tapestry of thick soapy lacing as well as a thick mound of frothy caparomas of dank orange peel passionfruit grapefruit rind and sweaty pine all bursting from the forefront with clean crisp grainy malt bringing up the backbone aggressive at first but smooths out very nicely over timetaste brings plenty of citrus dank pine and clean malt in sync upfront with herbal hops only gaining steam as they build to a finish straight from the forest floor dank bitter pine sweaty earthy hops and malty red berries superior depth and intensity to this profile with that little bit extra to push it over the edge while maintaining an overall harmonymouthfeel shows a mediumheavy body that is thick yet carries itself very well and is topped off with a perfectly balanced medium carbonation dense but balanced hoppiness is evened by malt to make for a semibitter but still primarily juicy finish remains incredible in its weight on the palate while never becoming downright unapproachablethis brew keeps an intensity only rivaled by its balance while there’s a ton of depth here that doesn’t challenge its overall drinkability a uniquely flavorful and relentless hop experience that has me understanding why it’s a classic,4.44,0.731766992
18,Fuzzy,pours a clouded amber to orange color with a fizzy small head which immediately diminishes to a small coatingsmells of leaf wrapped ripe peaches offering a bright fruitiness which comes close to actually cut a peach into half and enjoy its aromas this inherits not only the fruit‘s pulp but also its stone pith quality adding a soft soothing quality to the sprizzy slightly perfumy and floral fruitshas a higher finely nuanced carbonation with an effervescent finish among a lighter yet versatile and intense lighter bodywhile this is doubtlessly focussed entirely on peaches the flavors of the beer offer an initial mineralic quality white bread dough and matured still slightly bitter herbs peaches enter the palate with an early fruit sugar peak which stays till the end but fades down slowly and constantly the fruit itself is defined by a pleasant tartness sweeter peach pulp a light moldy touch among a flowery mildness which allows a rustic barnyard profile consisting of leather and cream cheese to cut through develops an almost creamy finish with an astonishing smoothness of the fruits and a finely beaded mouthfeel leading to a surprising well interweaved juiciness in which the maintaining tartness manages to shinethis tastes great everything comes together perfectly due to the beer‘s awesome mouthfeel and balance it is just as complex as a lambic with a cleverly integrated tartness labeling this unmistakably a sour but with a complexity which assures to be able to pick up the beer‘s subtle nuances,4.35,0.731109737
19,Gueuze 100% Lambic,2013 variant somewhat gentle but down the middle pour yields an almost opaque glowing gold beer topped off with a thin ring of bright white head that quickly recedes just beautiful nose is tart fruity and funky palate builds upon this with a robust a complex fruity character  getting some lemon orange and grapefruit peel this is definitely a strong funky and sour quality as well grassy oaky dry farmhouse notes of earth and hay slight spice to it and a wine like quality all of the flavors so smooth and perfectly intergrated beautifully light and slightly effervescent mouthfeel perfect beer,4.71,0.730979191
20,Double Dry Hopped Fort Point Pale Ale,this is so well balanced and very drinkable not as much of a novelty as a lot of the ddh juice bombs balanced citrus spicy and lightly malty amazingly refreshing,4.56,0.730972287
21,Framboos,a pour’s a merlot ruby rose color with some transparency the head is minimal with absent retention and lacings raspberry jolly rancher with sour patch kid elements an abundance of raspberries with some cherries and assorted berries popping out juicy sugary sweetness with subtle acidityfunkt bright crisp rich berries and fruit with lactic funk and a tad bit musty notes touch upon citrus lemon a little bit of vinegar some vinous like components and an oaky inclusionm medium to light body with scarce carbonation soft yet fairly flat with a morsel of dryness that’s integrated and balanced adeptlyo nice take on a fruited lambic that doesn’t come across as onedimensional a fragrant and aromatic nose with palatable complexities,4.45,0.730045294
22,Pliny The Elder,pours a clear crisp golden hue thin sudsy white head dissipates pretty quickly some light lacing is left behindaroma is a lovely pungent array of bright fresh pine orangey citrus with some floral notes  orange blossom honeysuckle and a hint of bright fresh cut lemon grass while the hops are quite aromatic there is a balance to this as there is a definite light malt backbone coming through even on the nosetaste is follows the nose with notes of citrus  lemon orange tangerine and orange rind  along with fresh pine and a bright floral notes solid crackery malt backbone comes through incredibly balanced and restrained while still being flavorful and complex mild bitterness on the back end with some more piney notes coming through the classic west coast profile comes through here but without trying to punch you in the palatefeel is light crisp and pretty smooth does have a slight slick oiliness to it moderate carbonation with gentle finishoverall this is a lovely ipa with a well earned reputation what was perhaps most surprising to me was its incredible balance and deftness in a market saturated with ipas that try to one up each other this beer knows what it is and does it so well admittedly ive wanted to this one for some time and it did not disappoint  i hope this is not the last time i have this beer,4.5,0.72902774
23,Keene Idea,32oz abc growler served in a snifter glass 9302015pours a lighter orangecopper body clear with a remarkable amount of clarity two finger white head with fair retention given the growler serving and very nice lacing looks like a west coaster through and through smells of tropical fruit dank durian fruit pineapple rich caramel malt slight herbal character a mild amount of spices to it deliciously balanced nose flavour is similarly excellent rich tropical fruit a bit of ripe pineapple and durian fruit slightly funky and spicy backed up by a rich caramel malt that is bold but not to the point of cloying or barleywine levels makes for a very balanced complex and rich double ipa mouthfeel is medium bodied substantial slightly slick and sticky but incredibly drinkable very mild heat to it overall a very rich double ipa with a lot of interesting spicy and tropical fruit character to it this is awesome,4.49,0.728880524
24,West Ashley,into a wine glass at a share amazingly clean soft nectarine and huge waves of apricot everything from the pit to the flesh perfectly balanced tartness to compliment it,4.53,0.726597197
25,Duck Duck Gooze,duck duck gooze batch 2pours a hazy amberyellow color with a small fizzy white head which leaves back no tracesmell is old potatoes glue blue cheese bright and crisp citrus peel with a soft flowery note to it and a slightly acetic tartness very well balanced not pungently sour while producing a nice funky blend got some wet hay on top of its aroma foundation with dried tomatoe bush adding a light herbal complexity to the nosehas a lower to medium carbonation complimenting perfectly to the refreshing tart yet complex and balanced beertastes of fresh squeezed lemon juice accompanied by a funky mushroom quality and a soft mineral aspect its mid palate produces a wood bark covered acetic sourness with a hint of white grape skin to it this results from a sugary malt sweetness which becomes recognizable only as a minor note against the omnipresent sourness while being able to cut through it finishes utmost soft very silk with a pungent dry acetic tone among lemon zest and leathery matured oak still carrying its subtle grape flavorwow this is pushing awas to a new level for me this is balanced and complex like no other american sour ive had so far it got the typical vinegar sourness which is dominating in many examples of american sours this is different though its acetic flavor is setting the balance in this which to me is remarkable by itself since it allows a pungent refreshing lemon sourness to open up the palate to many flavor layers creating an intriguing complexity which at no point gets boring,4.42,0.726564065
26,Double Dry Hopped All Citra Everything,canned 9 days agoa pours strawcolored opaque with a finger of dense white head excellent retention and intricate lacings bright tangerine intricate floral aroma with a bit of mango grapefruit and very light crackery maltt fresh cut tangerine both the flesh and pith dried flowers finishing with very light bitterness a moderate amount of sweetness supports the fruit and flowers superblym mediumfull body with fairly hefty creaminess mediumhigh carbonation with decent biteo delicious and fantastically drinkable a superb showcase of citra a bit green at this stage but that doesn’t detract much,4.75,0.726297111
27,Doppelganger,canned on 10918pours a hazy burnt orangepeach yellow with over a finger of fluffy white head solid head retention leaves froth around the edge and plenty of lacing spattered around the glass as it recedesaromas of creamy apricot and peaches citrus and ripe mango taut fleeting grassy notes add a delicate herbal edge to a lush tropical and lightly hoppy bouquettastes of dank mango dried oranges candied peach and light grapefruit zest deeply floral herbal bitterness dances in harmony with hazy tropical hops on the finish where the profile bursts excellently and reveals the height of its potentialmouthfeel shows a mediumrobust body with a good bit of dryness and an upperlevel carbonation that has a slight presence but tempers itself well among the burst flavor profile delicate prickly climax smooths to a fluffy fulfilling finish with a juicy crispness maintaining on the palate throughout minimalno alcohol presenceunique and eclecticallystructured nedipa there’s so much character here between the profile and construction on the palate and it all holds together so tenuously at a very high level it’s smooth and borderline sessionable by dipa standards and at its peak is both spectacular and approachable regardless it’s one of the more balanced and approachable examples of haze i’ve encountered,4.35,0.72597521
28,Abt 12,dark brown with a foamy tan head holding it up to the light reveals a slight translucence and possible cloudiness the aroma is rich and full bodied nicely carbonated tingly velvet the flavor is rich and robust not distinctive or identifiable just a hint of alcohol a very pleasant rich robust beer,4.03,0.725622476
29,Sante Adairius / Triple Rock Cellarman Barrel Aged Saison,l cross between white and pale good haze level white head which dissipates quicklys tartness bit of funk some fresh lemont crisp and bright good refined lemony tartness mild funkf crisp with some biteo very nice and refreshing offering from sara definitely will buy again,4.45,0.724966379
30,Flora Plum,well balanced fruited wild ale the beer is a vehicle for the plum i miss some of the nuance of flora as the base beer takes a backseat to the tartness and acidity of fresh plum the mouthfeel draws character from the plum skin with a finishing dryness and crisp tartness the flavors harmonize as they warm slightly with a fuller plum flesh flavor and aroma very nice expression of fresh plums,4.47,0.724724839
31,Double Dry Hopped Mylar Bags,drank on tap at other half brewing co brooklyn ny served in a tulipcloudy yellow ochre appearance the nearly opaque liquid was topped by a small frothy white cap that quickly dissolved minimal spotty lacing stuck along the glassthe aroma was amazingly hoppy and bright super dank and juicy cannabis definitely came to mind intense citrus notes too loads of juicy orange and tangerine some crisp wheatiness as well perhaps a bit simplistic overall but flawless neverthelessthe flavor profile was very similar to the nose and nearly as impressive citrus notes dominated loads of orange both juicy flesh and pithy rind tangerine was also noticeable somewhat tart and tangy pineapple also came to mind more punchy orange notes and pithy grapefruit rind on the back end and in the finish a fair amount of bitterness lingered after the swallowoutstanding mouthfeel super smooth and supple creamy and slick on the palate fuller bodied for the style the liquid contained an amazingly fine frothy effervescence that fluffed up beautifully on the palateother half brewing continues with their mission of putting out some of the greatest hoppy beers on the planet and double dry hopped mylar bags is possibly one of their most impressive releases to date this is a truly fantastic representation the style,4.79,0.724575913
32,Beatification,2018 edition poured into a tulip a clear bright golden color with a modest white head that quickly settled crisp citrus aroma  lemon and orange some brett funky esters and dough as well the taste was phenomenal juicy citrus notes mixed with grassy funky elements doughy bread and earthy elements moderately tart and very drinkable the cherry on top was the elegant oaky presence throughout not overwhelming but enough to easily notice exceptional,4.49,0.724554475
33,Pseudo Sue,murky creamsicle orange in color poured with a short soapy white foam with medium low retention sharo citrus tangerine and under ripe pineapple with a light dankness medium malty aromas medium bodied with medium light carbonation creamy rich silky smooth feel followed by boozy warmth that gets a little prickly at the finish citrus and pineapple hop flavors with a solid malt backbone spicy bitterness slowly expands through the middle pine hop and sharp citrus notes on the backend along with fruity flavors and boozy warmth finished semidryly with light fruity notes and lingering pine hop bitterness light fruity notes and malt provide just enough balance with fantastic fresh complex hop character smooth creamy feel with pleasant bitterness and just a touch of dankness this was excellent,4.4,0.724515878
34,Emerald Grouper,fairly fresh aquired in a trade no bottling datesuper tight white bubbly head on a beautiful yellowgold slight hazy body i like keeping in the sediment aroma is pretty standard grapefruity citrus piney but really clean and clear flavor is awesome everything you’d expect plus a smoother honeyed and lactose experience that delivers the hops in a soft and creamier manner sooo smooth for a big dipa unique given the familiar hop and malt profile,4.48,0.724403704
35,Abricot Du Fermier,bottle poured alight peachy color ale with a bubbly head with ok retention and minimal lacing aroma of light apricot and tart notes is pretty refreshing and pleasant taste is a nice mix of tart notes with some fresh apricot notes and a white winelike finish body is about average with good carbonation acidity level is kept at a reasonable level very refreshing with solid mix of complexity,4.22,0.724169689
36,Fuzzy Baby Ducks,canned on 52419pours a slightly cloudy golden dark orange body topped with a fluffy tightly composed white head excellent retention recedes evenly to a thick cap and uniform tapestry of lacingaromas burst with deeply juicy resinous tones of pineapple papaya and tropical zest a beautiful honeyed orange highlights the bouquet upfront occasionally dense bready spice and corn flakes pop on the backbone to support the deep citrusy sweetness with a deft herbal touch that defines the aromataste follows the bouquet with plenty of orange peel orange honey blossomcoated malt and juicy pineapple pine and grapefruit combo appear for a citrusyherbal prickle while a faint flaky malt builds and a slight cirusy creaminess both ties things together and gives the profile new life entering the finishswallowmouthfeel shows a body on the lighter side of medium and lifted by a creamy but slightly prickly carbonation oily resinous tones hold until the midpalate where a dense crispness based in the taut balance of malt and hops takes over welltamed bitterness peaking near the finish that dries subtly as the crispness peaksendlessly drinkable and packs incredible depth into 6 undoubtedly sweet in its fruitier tones but a calmly balancing malt and bitterness holds everything together effortlessly and brings this brew to the next level a spectacular ipa for all occasions,4.38,0.724039832
37,Great,amazing barleywine one of the best beers ive had pours a tad flat but expected for the style and from other reviewshard to describe how great this is it is the perfect level of sweetness without being too sweet light bodied and extremely smooth the barrel is subdued and works perfectly to balance the sweetness,4.8,0.723144053
