,product_name,product_review,user_rating,similarity_score
195,Mornin' Delight,2018 bottle opened jan 2019a very smooth coffee sweet molasses vanilla maple and mellow roasted malts very full and smooth but remains nicely balanced and not overboard perfecta opaque black with medium brown head that quickly falls to a nice ring around the glassf wonderful flavors of coffee maple molasses vanilla chocolate mild roast malt perfectly blended flavors that follow directly from the nose very smoothm full body with nice mediumlow carbonation fully coats the mouth and lingers in the pallet remaining chocolate coffee and maple syrup with a balanced finisho an excellent stout and one of the best i’ve had the smooth and creamy coffee maple and mocha flavors melt into a delicious stout highly recommend and i like some more please,4.73,0.702447827
196,Maple Bacon Coffee Porter,650ml bottle 2018 vintage poured into an oversized funky buddha snifter glass enjoyed on 112418 reviewed from tasting journeythe beer pours a jet black color thick and with a nice viscosity opaque with a loose khaki head that rises nicely with moderate retention and lacing the aroma is pleasant sweet and rich maple leaps out with chocolate and roasty coffee dark grains cream and a nice salinity emerges that evokes bacon the flavors are good really coffee forward with a nice roast moderate acidity but a good richness that plays nicely with toasted dark malts while the maple comes out behind the roasted quality toning down the beer and bringing out some cream flavors while a lingering saltiness washes the palate the mouthfeel is okay a thinner medium body that coats well lively and bubbly texture with a nice soft finishverdict a good adjunct porter from funky buddha the texture is a bit thin relative to the amount of flavor packed into this beer while causes there to be a bit of balance issue in terms of the actual flavors involved the maple and bacon are great nuances to what is a very coffee forward beer,4.01,0.702440877
197,Beyond Good And Evil,2014 batch enjoyed in 2017 and it was still amazing huge oaky bourbon aroma maple still strong fairly nice mouthfeel and plenty of sweetness absolutely delicious sweet stout,4.91,0.702433451
198,Cable Car,poured from the bottle at toronado in san diego on 52616 2009 releaseappears a vibrant hazy orange aroma is complex with layers of peach apricot pear white grape lemon lime definitely fruit forward tinged with woodsy barrel notes flavor is highly complex  this has aged super well again there is a melange of stone fruit flavors balanced with tartness and funk and just the right amount of acidity very drinkable yet at the same time its totally a sipping beer due to the multiple layers of flavor smooth and zippy with a pleasing fine carbonation fully intactif forced to choose i would pick this over ddg,5,0.702385602
199,The Broken Truck,batch 2 is a delicious beer with just the right amount of sour funk and barrel presence pillowy and light but with a nice full mouthfeel very balanced with complex flavors that keep coming for minutes after you swallow worthy of the hype,4.6,0.702373425
200,Maman,maman 2018pours a truly oily coal black color with a fluffy beige head receeding to a smaller ring of lacingsmells of profound bitter chocolate bakers chocolate campfire and a gentle yet profound bourbon aroma relatively straight forward on the nose yet equally intriguing as for its complex bourbon and chocolate interplaydrinks surprisingly easy thick with a fuller body its booze being perfectly soaked up by the luscious chocolate flavor profile this features almost a flat level of carbonation while the beer‘s mouthfeel is that that thick that it benefits tremendously from the lack of potentially mineralic effervescence highlighting its multi layered chocolate decadencetastes of rich milk chocolate soothed by layers of whipped cream and oaky slighty warming bourbon barrel warms up even more with a rustic barrel presence soothed by the incredibly smooth and silk mouthfeel accompanied by bitter chocolate and slightly spicy licorice finishes a little sweeter reminiscend of a rock sugar cocoa blend tied together by tobacco and even more whipped cream more licorice and a little bit of charred malts topped off by a long lasting spicy bourbon aftertastethis is astonishtingly complex while the beers drinks incredibly easy at the same time also this offers the most incredible mouthfeel smooth and soft caressing the tongue in the most pleasant way while handling the 13 abv playfully on the one hand this is a pretty straight forward chocolate imperial stout on the other hand this opens up the palate to a plethora of finely nuanced flavors resulting in a truly complex tasting beer what a treat this is a clear winner due to its emphasized world class mouthfeel allowing the flavors to shine like in no other beer,5,0.702136605
201,Moment Of Clarity,this one pours a fairly dark black color with a small head and not much lacingthis has a moderate dark grade maple aroma to it with some light creamy coffee vanilla and smokey roastthe maple character is not overdone here  its there but doesnt add an overwhelming sweetness at all which is nice theres a moderate level of roasty and vanillay coffee character with a healthy roast on the back end to balance any extra sweetness its a fudgy stout backbone toothis is medium bodied and very drinkable with a nice creamy candied finish to itthis is a cute little maple stout  it works fairly well for me,4.26,0.702135034
202,Schaerbeekse Kriek,sampled from a 750ml bottle with a bottle date of 12232011 and a best by date of 12232021 thanks ssteina  a brilliant red with a hazy finish and a healthy white heads  wonderful cherry with both sweet and sour notes and incredible richness fantastict  wonderful sour  tart bite but not overwhelming wonderful cherry flavors that mix right in and hold their ownm  a moderately thick consistency with a moderately low carbonation just righto  outstanding,4.48,0.702132596
203,Hopslam Ale,picked up only one can because of the price but will definitely get more impressivepours a very clear light amber with a medium head that lingers for a long time smell light sweet hoppy dried fruit taste stronger than smell good balance of sweet and bitter bitterness lingers on the palate but with rich flavor notes are honey dried fruit pear floral mild pine and a touch earthy at 10 the alcohol is very noticeable the honey adds a nice balance of sweetness that is not overbearing mouthfeel is incredibly smooth and fullbodiedvery nice iipa definitely worth looking for price tag is high so good for special occasions,4.38,0.701834675
204,Montmorency Vs Balaton,not impressed with this given the hype nice cherry flavor but not too intense mildly tart a little barrel its well balanced with no off flavors but nothing jumps out,4,0.701691415
205,Fou' Foune,first fresh foune 2017 beautiful fruit lambic with standard cantillon mineral undertones soft acidity and tartness thick ripe appricot definitely get the “yoghurtiness” others have described would still be interested to stick a few years on it to see how the fruit charecter develops,4.54,0.701690823
206,It Was All A Dream,incredibly sweet a straight up dessert beer for sure it had delicious intense coconut dominating the overall flavor profile mouthfeel was excellent no complains at all only good in small quantities though due to the cloying sweetness,4.45,0.701629894
207,Aurelian Lure,had this alongside an oso arbre qui donne which just as personal preference i liked slightly better hazy orangeyellow color with very little head aroma was very funky with the apricot complementing nicely the taste was tart and crisp with the best way i can describe it as funky fresh the apricots were there but the funky and tart slightly puckering mouthfeel that finished not as dry as expected are what make the beer special,4.34,0.7015278
208,Double Dry Hopped Double Mosaic Dream,mosaic shines incredibly well all over the ale namely the aromas the hops work well with lactose on the palate plus some peach supporting it nicely in back thick mouthfeel with juicy peach qualities lingering,4.5,0.701486749
209,Trappistes Rochefort 10,pours mahogany has a very fine head great lacing is very potent very powerful notes of chocolate raisin fig vanilla malt dark fruit rich smooth multidimensional in flavor complex in the belgian quad manner mouthfeel never goes anything but smooth and rich but demands to be savored slowly the best of abbey ale flavor and complex notes sad when you drink your last one never dull always remembered fondly 5 all the way no other rating will do for this style a reference in belgian trappist ales,5,0.701443655
210,Oude Geuze Golden Blend,look golden yellow with a light carbonated 1 inch head smell big funk lemon and citrus notes throughout taste citrus fruits floral and nice funky sourness feel insanely light and aromatic crisp and good balanced carbination overall a real pleasure to drink,4.46,0.701323716
211,Oude Geuze Golden Blend,2014 vintage poured from a 375 pours a golden hue with ample carbonation considerably more complex than the typical geuze  crisp apple and funk would age very nicely,4.59,0.701254261
212,Abrasive Ale,poured from a pint can into a tulipthe aroma is darker than apricot lighter than copper or amber a dark golden hazy masterpiece a decent onefinger head gives way to a persistent skein of froth and faint lacingaromas of mango pineapple peachnectarine apricot white plum white grape berry and lemonlemongrass with hints of white pepper and clear alcohol just a touch of pineresin the brew has a nice complex aroma but it is somewhat subdued in other wordsgood but it would be nice to have more of itthe aromas were skewed more sweet the flavors are decidedly more bitter but not unpleasantly so very well balanced actually plenty of malt backbone greets the tip of the tongue with peach mango grapefruit and pineapple all present the midpalate is greeted with more malty sweetness balanced with grainybiscuity goodness before transitioning to piney and dank hop notes the finish features a return of white peppery goodness and a touch a booze the abv is very well hiddenthe brew is medium bodied with excellent carbonation and never gets sticky as brews of this abv can sometimes be this one almost gets to crisp level in its finishthis is an excellent american dipa wellbalanced in every way,4.44,0.701193401
213,Juicy,2016 bottle batch 3 into hill farmstead flute bottlelight amber in color with a good bit of foam head upon an aggressive pour wonderful floral aromas and taste fruity flavor brett is present but not offensive not overly tart or overly acidic very balanced saison that is pleasant and easy to drink one of the best ive had,4.6,0.701162421
214,Atrial Rubicite,i seem to find that many vaunted sours do not meet the hype atrial rubicite not only meets the hype it exceeds it juicy great depth of fruit flavors beautiful barrel character with a crisp and smooth mouthfeel to finish carbonation level was spot on so thankful i was able to try this masterpiece,4.75,0.701077275
215,Montmorency Vs Balaton,batch 3 poured into a taster tart cherries well balanced with a natural cherrypie sweetness and a bit of spice and oak very well integrated and cleanhighly recommended,4.67,0.701059235
216,Schaerbeekse Kriek,from a 750 ml bottle to a tulipaa normal pour produces very little head just a thin pink cap that fades quickly to a collar the beer is raspberry in color and slightly cloudy nothing spectacular to look at but it suits the stylesthe aroma on this older 2011 bottle is subdued compared to some lambics but i still smell a good bit of sour cherry other scents include champagne cider vinegar and a light dose of earthy barnyard funk acidity is moderate to low for the styletthe taste is flush with clean acidity as well as some mostlydry oaky funk and more of that lovely sweetsour cherry taste it is very balanced and impresses with its focus rather than outright sourness or fruit flavorsmthe feel is slightly heavier than some lambic style beers with an assertive but smooth carbonation that really compliments the flavor perhaps the best feeling lambic i have ever hadowhat a great beer it sounds stupid but the smell and flavor are so simple and clean that the beer almost becomes more complex as i try to locate all the little subtle aromas and nuances that make this beer taste so good unlike some true belgian lambics i found this beer to be approachable as well ie not hugely sour or funky or hard to appreciate the mouthfeel is also nearly perfect for the style,4.56,0.70081968
217,4th Anniversary,outstanding citrus and a particularly attractive pour lots of mango and pineapple to the noise and smell mouthfeel is particularly chewy surprisingly in an ipa thick very rich fantastic my favorite other half beer so far,4.74,0.700742769
218,King Julius,review 800another incredible nestyle ipa from the alwaysamazing tree house if this one was disappointing at all it’s only because it didn’t seem so extraordinary as to be one of the top 3 ne ipas ever as rated on ba  but this was still an amazing brew nonetheless maybe i waited a little too long with this one  canned date 72919 but i had wanted to wait to make this review 800 looks wonderful pours a nice hazy orangepale yellow color with some nice fluffy white head and glorious thick wide rings of lingering lacing that stayed throughout smells of very ripe fruit with food hoppiness  pineapple guava tangerine mango melon grapefruit and passionfruit some nice aromas of malt creamy vanilla bread and then some more faint floral and dank notes in the background taste follows the nose extremely well balanced and with good depth and complexity again a little dankness towards the finish especially as the beer warmed very well hidden higher abv smooth luscious slightly sticky fairly soft mouthfeel that coated the palate and was very juicy and easy to enjoy good amount of carbonation i thoroughly enjoyed this one just wish it could have had a little more power behind the bitter hops in order to tip the scales versus the solid malt backbone,4.5,0.700682693
219,Oude Geuze Vintage,ogv 12 375ml on 172207pours a clouded amber color with a small soon disappearing head which is unusual for 3fs geuze which normally stays coated by a fluffy lacing the whole timesmells of oak sweeter blue cheese stale malts earthen mushrooms and a wet cellar quality the typical 3f funk settles also in together with a nice lemon zest sourness softer than on their regular geuze leans heavily on the oaken barrel with an intriguing sweet and sour interplay on tophas a soft mouthfeel with a pleasant complexity to it amped up by an effervescent finish holding the sourness in balancetastes aqueous almost flat with some wood bark and muted toffee malts turns more wooden during midpalate with an uncompromising lemon tartness during the finish the beer ends utmost dry with a lingering lemon zest tartness revealing mushrooms mold and cream cheeseactually this appears less balanced than the regular geuze especially next to ag the ogv is just not as complex its late sourness is almost too much to take overpowering everything else with just a crisp lemon appearance cutting noteably through,3.67,0.700665708
220,Oude Geuze Cuvée Armand & Gaston,strong head production with over two fingers of fluffy gorgeous snow white head from a moderate pour retention is good leaving no lacing behind almost a milky haze to the burnished gold body light straw color in the sun some liveliness as well but its not a sparkling bodysour and funky nose along with waves of oak honey and wildflowers that occasionally waft over from feet away vinegar hay flowers honey oak must very light skunk grass apple its a complex melange of potent aromas that is really difficult to describe like the wind blowing through the trees and carrying with it all of the notes of the forest mixed togethertart and mildly fizzy on the palate with a sourness that comes across almost neutral and a touch vinegary the sourness yields to robust oaky tones but as the finish quickly sets in with tones of apple pear and cider the sour clings to the gums similarly musty and very slightly skunky on the palate with tones of earth leather tannins and mushroomsthe flavor ends with a light dancing quality but up front its more of a soft playful punch gentle but with a surprising firmness very lively fairly dry and overall a very short sip on the palate yet with lingering sour and funk on the tongue and gums one can very quickly be ready for the next sip or just as easily savor the lasting funkoverall one of the more difficult beers to rate and review i have encountered in ages in terms of flavor it is so complex and well blended that it truly is tough to describe and yet the overall presentation is nearly flawless i quibble a touch with the mouthfeel although its by no means poor rather it is perhaps the only part of this entire experience that i find less that world class primarily due to the fizz up front that makes savoring the entire sip difficult instead of focusing on the back half and aftertaste which is about all that it allows that lingering finish is truly the feels saving grace along with the dry character and lingering funk and sournesswithout question a superb expression of brewers art fully deserving of its high ratings and worthy of carrying the burden of drie fonteinens lofty reputation,4.51,0.700513324
221,Dorothy (Wine Barrel Aged),b2 april 4 2017pours out a mostly clear brilliant golden straw color creamy bright white head with suds atop and great retention aromas of lemon hay fresh cut grass floral oak mellow earthy funk spice and bright citrus peel in there on palate there is the above mentioned notes with even more depth and coherence quite a pungent hit of fruity citrus and fuzzy peach flavor dancing in there almost invoking characteristics of a neipa but there is this beautiful funky dryness and oak character to balance it out hay fresh cut grass lemon peel musty grape skin white grape mellow acidity oaky sweetness hinting at vanilla the feel is so effervescent and crisp wonderfully complimenting the flavor profile,5,0.700220219
222,Beer:Barrel:Time,it poured a super thick and viscous in the glass pitch black color with very little head very little carbonation the smell is sweet with tons of fudge interlace with bourbon and oak not complex by any means but so balance sweet and rich the flavor profile is just the same  so much rich chocolate fudge in the mouth balanced out with the warming touch of bourbon its sweet with a lot of depth that includes dark chocolate vanilla oak and bourbon all the things you would dream of in a barrel aged stout the mouthfeel is thick and rich without much warmth for a 15 abv beer overall this is a superb beer well remarkable for its balance of flavors its depth of flavors and the thickness some may say its overrated because its not too different from other easy to obtain stouts i have to disagree it is well perfected with its sweetness balance and the bourbon,4.69,0.700116133
223,Trappist Westvleteren 8 (VIII),muddy ruddy brown with a fat finger of creamy tan headraisins figs prune cherry and slight earthy hops in the nose similar tasting with a moderate bitterness and very clean finish with just a hint of sweetness and bitterness duking it out incredibly well balanced in that regardmedium bodied slightly chewy with heavy carbonation very very tasty,4.4,0.700096794
224,Framboise Du Fermier,wow the smell on this beer is just heavenly full of fresh raspberries full of tartness and sweetness basically liquid raspberry in pure sour saison form has all of the complex and beautifully balanced flavors and feel from the original but now has a fresh fruit to star up front mouthfeel finish did feel a little grainy and acidic on the end but im just nitpicking at this point,4.73,0.699828328
225,Fort Point Pale Ale,ahazy pineapple juice look with a nice head that dissipates quickly sbig tropical punch of sweet fruit aroma with a slight sweet malt background mthick and pillowy but also quite peppery and effervescent tsweet deception with a smooth and lasting bitterness oreally great beer the peppery flavour was a little harsh on the senses,5,0.699790298
226,Double Sunshine,pours orange with a clarity that is nearly translucent with the first 12oz of the beer poured into the glass it turns to a starburst opaque translucence when the final ounces are poured into the glass head is a finger and a half of white foam aroma is orange tangerine papaya and light guava tropical citrus notes are heavy and out front with biscuity earthy nutty malts and herbal hops adding a big backdrop flavor profile is orange tangerine papaya and guava with notable herbal floral hops and biscuity earthy nutty malts despite the naming of northeast ipa the hops are much stickier and less sweet than others of the style malts still serve as a backdrop but not an after thought it carries a quality balance between hops and malts while leaning lightly towards the sweet side mouth feel is medium in thickness with a crisp texture that touches on effervescent overall very flavorful and surprisingly balanced reviewed per the new england ipa style due to its style listing on its profile at the time of reviewserved in a 12oz snifter from a 16oz can can 1011 reviewed 122 reviewed per ne ipa style guidelines,4.23,0.69976376
227,Trappistes Rochefort 10,pours chestnut with garnet highlights topped by nearly an inch of coarse khaki froth muted aroma smells of raisins caramel apples alcohol and perhaps the barest whiff of nutmeg or other indeterminate spices shimmering swaths of lacing coat the glass as the beer recedesbig time flavor up front features toasted bread raisins caramel nutmeg warming alcohol and perhaps even some allspice everything is nicely balanced and melds beautifully into a whole greater than the sum of its parts belgian yeast lends the obligatory character warming reveals notes of apple and cherry cough syrup mediumheavy body and fine vivacious carbonation make for a lush vigorous mouthfeel that supports the bold flavor profile with aplomb while the dry finish resets the palate brilliantlywhile i wasnt blown away by the other rocheforts in the series this bad boy brings it big time it manages to come off as refreshing and vital even as it flaunts its bold complex flavor profile while not especially distinctive in any particular regard theres no denying this is brilliantly executed from top to bottom,4.15,0.699699784
228,Alter Ego,062015  what a surprise and boy does it not disappoint all the juiciness of julius yet a really nice bite in the back end fairly crisp lightly bitter yet very refreshing and clean,4.46,0.699595254
229,Abrasive Ale,im sharing a can of this with my broinlaw over the 4th holiday it poured a hazy orangish with no head and no lace the scent had hints of sweetness and citrus spice the taste was nicely balanced and easy to drink for a dipa the mouthfeel was fuller in body with good carbonation overall it was a solid beer,3.95,0.699443375
230,Beer Geek Vanilla Shake - Bourbon Barrel-Aged,2016 batch ontap served in a mikkeller stemmed glass at mikkeller bangkoksinful black with some deep ruddy brown hue along the edge when hits the light rich tan frothy head builds up to stand for a while before subsiding to some foamy sheet atop and leaving plenty of refined yet sticky lace sip by sipin a nose the aroma delicately comprises of big vanilla very rich dark and creamy chocolate cocoa mocha caramel dark bread toasted biscuit charred nut also with some touch of bourbon that is reminiscent of oaky woody spicy and mellow fruitchocolate fudge dark and creamy chocolate cocoa mocha vanilla caramel dark bread toasted biscuit charred nut all of these flavors are harmoniously blended up creating super delicious and luscious taste bourbon barrel yields more complexity with its spicy woody oak and some mellow fruitiness profile it is vanilla and sweet overall but in very good way and not that cloying as it is counterbalanced by all those delicacy and tasty tangfull and rich body but not that too sticky with some carbonation to yield smoothness and some crisp mouthfeel through the palate finish is pleasantly drythis one is just really close to flawless completely blow me away complex solid tasty and alcohol is very well hidden could never be missed i also keep one bottle for cellaring and will see how it is developed by year to come,4.7,0.699402436
231,Thicket,375ml bottle poured into a large stema pours dark purple with ruby edges a thin purplehued head forms and quickly fades into a lingering collar s tart funky and full of freshly pureed fruit t extremely layered tartness up front moving quickly into a nice full funk bright blackberries woodoak elements sour fruit skinstannins blackberry seedsearthinessslight balsamic quality m well carbonated but not overly done initially very bubbly but quickly fades medium bodied with a definite sweetfruity viscosity o simply fantastic expertly crafted wild ale with incredible fresh fruit notes balanced with the perfect level of funktartness,4.87,0.69939213
